{
  "schemaVersion": 1,
  "benchmark": {
    "name": "replicated-scenario-summary",
    "source": {
      "revision": "4aa9919e5d8414c0ad556708b9e08ca3e9d50f56",
      "dirty": false
    }
  },
  "runtime": {
    "node": "v20.20.2",
    "platform": "linux"
  },
  "hardware": {
    "os": "Linux 6.6.87.2-microsoft-standard-WSL2",
    "architecture": "x64",
    "cpu": "AMD Ryzen 7 7700X 8-Core Processor",
    "gpuMemoryBytes": null
  },
  "workload": {
    "seed": "deterministic-index-no-rng",
    "populations": [
      {
        "count": 1000,
        "unit": "result-records",
        "scope": "synthetic replicate-summary input"
      },
      {
        "count": 10000,
        "unit": "result-records",
        "scope": "synthetic replicate-summary input"
      },
      {
        "count": 100000,
        "unit": "result-records",
        "scope": "synthetic replicate-summary input"
      }
    ],
    "runCounts": [
      1000,
      10000,
      100000
    ],
    "outputsPerRun": 2,
    "groups": 2,
    "resultsAreSynthetic": true
  },
  "configuration": {
    "warmupRuns": 1,
    "repetitions": 7,
    "aggregation": "sample SD and Type 7 descriptive quantiles"
  },
  "limits": {
    "farmEngineMaxAnimals": 10000,
    "rendererMaxAnimals": 10000,
    "numericKernelMaxAnimalsMeasured": 100000
  },
  "phases": {
    "engine": {
      "status": "not-measured",
      "measurements": []
    },
    "snapshot": {
      "status": "not-measured",
      "measurements": []
    },
    "serialization": {
      "status": "not-measured",
      "measurements": []
    },
    "worker": {
      "status": "not-measured",
      "measurements": []
    },
    "ui": {
      "status": "not-measured",
      "measurements": []
    },
    "layout": {
      "status": "measured",
      "measurements": [
        {
          "phase": "layout",
          "metric": "summary_runtime",
          "unit": "ms",
          "statistics": {
            "sampleCount": 21,
            "median": 12.511415999999997,
            "spread": {
              "min": 1.8029969999999764,
              "max": 139.803902,
              "range": 138.00090500000002
            }
          },
          "details": "Per-size measurements are in results.",
          "population": "all configured populations",
          "source": "replicated-scenario-summary layout measurement"
        },
        {
          "phase": "layout",
          "metric": "peak_observed_heap_used",
          "unit": "byte",
          "statistics": {
            "sampleCount": 3,
            "values": [
              14847504,
              25075336,
              113637408
            ]
          },
          "details": "Process heapUsed sampled after each aggregation; includes retained benchmark inputs.",
          "population": "all configured populations",
          "source": "replicated-scenario-summary layout measurement"
        }
      ]
    },
    "render": {
      "status": "not-measured",
      "measurements": []
    },
    "startup": {
      "status": "not-measured",
      "measurements": []
    }
  },
  "timingBoundaries": [
    {
      "phase": "layout",
      "timed": [
        "One summarizeReplicates call over the already constructed result records."
      ],
      "notTimed": [
        "Synthetic input construction.",
        "Initial warm-up aggregation.",
        "Heap sampling after each timed call."
      ]
    }
  ],
  "results": [
    {
      "runs": 1000,
      "summarizeMs": {
        "sampleCount": 7,
        "median": 1.8029969999999764,
        "spread": {
          "min": 1.3120910000000094,
          "max": 3.8654149999999987,
          "range": 2.5533239999999893
        }
      },
      "heapUsedBytes": 14847504
    },
    {
      "runs": 10000,
      "summarizeMs": {
        "sampleCount": 7,
        "median": 12.511415999999997,
        "spread": {
          "min": 12.226009000000005,
          "max": 16.946735999999987,
          "range": 4.720726999999982
        }
      },
      "heapUsedBytes": 25075336
    },
    {
      "runs": 100000,
      "summarizeMs": {
        "sampleCount": 7,
        "median": 139.803902,
        "spread": {
          "min": 136.501126,
          "max": 152.98004500000008,
          "range": 16.478919000000076
        }
      },
      "heapUsedBytes": 113637408
    }
  ],
  "limitations": [
    "Synthetic inputs isolate reducer cost and are not scenario-engine runtime.",
    "Heap is sampled process heap after each workload, not a per-call allocation profile."
  ]
}
